{
  "$ref": "#/definitions/skills",
  "definitions": {
    "skills": {
      "type": "object",
      "properties": {
        "languages": {
          "type": "array",
          "items": {
            "type": "string"
          }
        },
        "frameworks": {
          "type": "array",
          "items": {
            "type": "string"
          }
        },
        "tools": {
          "type": "array",
          "items": {
            "type": "string"
          }
        },
        "areas": {
          "type": "array",
          "items": {
            "type": "string"
          }
        },
        "$schema": {
          "type": "string"
        }
      },
      "required": [
        "languages",
        "frameworks",
        "tools",
        "areas"
      ],
      "additionalProperties": false
    }
  },
  "$schema": "http://json-schema.org/draft-07/schema#"
}